{
  "pdf_url": "https://kyc-files.s3.amazonaws.com/scan_pdfs/httpwwwexamplecom_2020-02-11_22-40-58-UTC_seACGC.pdf",
  "messages": {
    "info": ["This is a high traffic site (Alexa rank 13983)"],
    "warn": [
      "The following required pages could not be found: Contact About Us Page",
      "The following required pages could not be found: Delivery Policy",
      "The following required pages could not be found: Payment Policy",
      "The following required pages could not be found: Refund Policy",
      "The following required pages could not be found: Return Policy",
      "The following required pages could not be found: Privacy Policy",
      "The following required pages could not be found: Terms of Service",
      "Corporate or DBA name match not found on Terms and Conditions Page",
      "No personal address was provided.",
      "No business address was provided.",
      "No Yelp! results were found.",
      "Unable to search Pipl; at least one name or phone number required.",
      "No company name was provided, could not search Complaints Board",
      "Yelp! search not performed; no business address provided",
      "No Google Places search performed because no company address was provided."
    ],
    "ok": [
      "Prohibited phrases were not found.",
      "No Consumer Financial Protection Bureau results Consumer Complaints Database results were found.",
      "Google SafeBrowsing reported no malware or phishing.",
      "No search results found on the Federal Trade Commission web site.",
      "No reasonable OFAC SDN matches were found.",
      "No Justia lawsuits found.",
      "Alexa reported no adult content."
    ],
    "crit": [
      "YellowPages.com requires a business address.",
      "Better Business Bureau module not run. No business address was provided.",
      "OpenCorporates could not run because a jurisdiction could not be determined from the address.",
      "OpenCorporates corporate search not run. No business address was provided."
    ]
  },
  "pages": {
    "n_scraped_pages": 1,
    "n_discovered_urls": 1,
    "language": null,
    "page_limit": 100
  },
  "invalid_addresses": [],
  "alexa": {
    "adult": false,
    "rank": 13983
  },
  "bbb_results": {},
  "google_places_results": "",
  "ms_entities_results": [
    {
      "rankingResponse": {
        "sidebar": {
          "items": [
            {
              "answerType": "Entities",
              "resultIndex": 0,
              "value": {
                "id": "https://www.bingapis.com/api/v7/#Entities.0"
              }
            }
          ]
        }
      },
      "queryContext": {
        "originalQuery": "Company Name, Inc "
      },
      "_type": "SearchResponse",
      "entities": {
        "value": [
          {
            "description": "\"Company\" is a song by Canadian singer Justin Bieber from his fourth studio album Purpose. Written by Bieber, Poo Bear, James Abrahart, Andreas Schuller, Thomas Troelsen, James Wong and Leroy Clampitt, the song was produced by Axident, Gladius, Big Taste and co-produced by Boyd. It was released to American rhythmic contemporary and contemporary hit radio stations on March 8, 2016 as the album's fourth and final single. It is an electropop and R&B song, with bass guitar, guitar and percussion in its instrumentation. Lyrically, \"Company\" talks about looking forward to getting to know someone attractive, but also sets some healthy boundaries for doing so.",
            "image": {
              "name": "Company",
              "height": 72,
              "width": 72,
              "hostPageUrl": "http://upload.wikimedia.org/wikipedia/en/0/0b/Company_remix_cover.png",
              "provider": [
                {
                  "url": "http://en.wikipedia.org/wiki/Company_(Justin_Bieber_song)",
                  "_type": "Organization"
                }
              ],
              "sourceHeight": 300,
              "thumbnailUrl": "https://www.bing.com/th?id=AMMS_3e1c9a4c24b0c774dfb5ff01d3157d54&w=50&h=50&c=7&rs=1&qlt=80&cdv=1&pid=16.1",
              "sourceWidth": 300
            },
            "bingId": "2cb7e611-0446-41e2-6c5a-d4bac4c748e2",
            "contractualRules": [
              {
                "url": "http://en.wikipedia.org/wiki/Company_(Justin_Bieber_song)",
                "_type": "ContractualRules/MediaAttribution",
                "mustBeCloseToContent": true,
                "targetPropertyName": "image"
              }
            ],
            "webSearchUrl": "https://www.bing.com/entityexplore?q=Company&filters=sid:%222cb7e611-0446-41e2-6c5a-d4bac4c748e2%22&elv=AXXfrEiqqD9r3GuelwApulpMu6DZna0p8tyX6kkB0yKF1gFhfpRvHT5U73Dj6JG5rnqwj0Nd5FQ5y*aKmZwmspMGkIJpRcaFsc2iVyBow7h5",
            "entityPresentationInfo": {
              "entityScenario": "DisambiguationItem",
              "entityTypeHints": ["Composition"]
            },
            "id": "https://www.bingapis.com/api/v7/#Entities.0",
            "name": "Company"
          }
        ]
      }
    }
  ],
  "cfpb_results": {},
  "classification_data": {
    "privacy_policy": false,
    "contact_about_us": false,
    "delivery_policy": false,
    "refund_policy": false,
    "return_policy": false,
    "terms_of_service": false,
    "payment_policy": false,
    "name_in_tos": false
  },
  "complaintsboard_complaints": null,
  "corporationwiki_results": "disabled",
  "facebook_places_results": "disabled",
  "ftc_result": false,
  "justia_dockets": {
    "n_scraped": 0,
    "n_total": 171
  },
  "g2_compass_results": [
    {
      "status": "complete",
      "site_active": null,
      "compass_score": 0,
      "request_id": "633c15a2-78e7-4b8a-917c-b81c58e1a1ae",
      "valid_url": true,
      "search_term": {
        "merchant_url": "http://www.example.com/",
        "merchant_name": "Company Name, Inc"
      },
      "fraudfile_matches": [],
      "reason_codes": [
        {
          "code": 105150,
          "description": "URL previously associated with high-risk MCC"
        }
      ]
    }
  ],
  "kyc2020_results": "disabled",
  "maps_results": [
    {
      "latitude": 42.1596,
      "longitude": -70.8217,
      "address": "93.184.216.34"
    }
  ],
  "malware_detections": {
    "phishings": 0,
    "malwares": 0
  },
  "ofac_results": {
    "location": [],
    "results": [],
    "name": []
  },
  "opencorporates_results": [],
  "pipl_results": null,
  "ripoff_reports": null,
  "hosting_location": "US",
  "phrases_result": {
    "n_total": null,
    "n_total_required": null
  },
  "parked": false,
  "parked_reason": "",
  "ssltest_result": "disabled",
  "whois_results": {
    "status": [
      "clientDeleteProhibited https://icann.org/epp#clientDeleteProhibited",
      "clientTransferProhibited https://icann.org/epp#clientTransferProhibited",
      "clientUpdateProhibited https://icann.org/epp#clientUpdateProhibited"
    ],
    "updated_date": ["2019-08-14T07:04:41"],
    "nameservers": ["a.iana-servers.net", "b.iana-servers.net"],
    "expiration_date": ["2020-08-13T04:00:00"],
    "creation_date": ["1995-08-14T04:00:00"],
    "raw": [
      "   Domain Name: EXAMPLE.COM\n   Registry Domain ID: 2336799_DOMAIN_COM-VRSN\n   Registrar WHOIS Server: whois.iana.org\n   Registrar URL: http://res-dom.iana.org\n   Updated Date: 2019-08-14T07:04:41Z\n   Creation Date: 1995-08-14T04:00:00Z\n   Registry Expiry Date: 2020-08-13T04:00:00Z\n   Registrar: RESERVED-Internet Assigned Numbers Authority\n   Registrar IANA ID: 376\n   Registrar Abuse Contact Email:\n   Registrar Abuse Contact Phone:\n   Domain Status: clientDeleteProhibited https://icann.org/epp#clientDeleteProhibited\n   Domain Status: clientTransferProhibited https://icann.org/epp#clientTransferProhibited\n   Domain Status: clientUpdateProhibited https://icann.org/epp#clientUpdateProhibited\n   Name Server: A.IANA-SERVERS.NET\n   Name Server: B.IANA-SERVERS.NET\n   DNSSEC: signedDelegation\n   DNSSEC DS Data: 31589 8 1 3490A6806D47F17A34C29E2CE80E8A999FFBE4BE\n   DNSSEC DS Data: 31589 8 2 CDE0D742D6998AA554A92D890F8184C698CFAC8A26FA59875A990C03E576343C\n   DNSSEC DS Data: 43547 8 1 B6225AB2CC613E0DCA7962BDC2342EA4F1B56083\n   DNSSEC DS Data: 43547 8 2 615A64233543F66F44D68933625B17497C89A70E858ED76A2145997EDF96A918\n   DNSSEC DS Data: 31406 8 1 189968811E6EBA862DD6C209F75623D8D9ED9142\n   DNSSEC DS Data: 31406 8 2 F78CF3344F72137235098ECBBD08947C2C9001C7F6A085A17F518B5D8F6B916D\n   URL of the ICANN Whois Inaccuracy Complaint Form: https://www.icann.org/wicf/\n>>> Last update of whois database: 2020-02-11T22:37:42Z <<<\n\nFor more information on Whois status codes, please visit https://icann.org/epp\n\nNOTICE: The expiration date displayed in this record is the date the\nregistrar's sponsorship of the domain name registration in the registry is\ncurrently set to expire. This date does not necessarily reflect the expiration\ndate of the domain name registrant's agreement with the sponsoring\nregistrar.  Users may consult the sponsoring registrar's Whois database to\nview the registrar's reported date of expiration for this registration.\n\nTERMS OF USE: You are not authorized to access or query our Whois\ndatabase through the use of electronic processes that are high-volume and\nautomated except as reasonably necessary to register domain names or\nmodify existing registrations; the Data in VeriSign Global Registry\nServices' (\"VeriSign\") Whois database is provided by VeriSign for\ninformation purposes only, and to assist persons in obtaining information\nabout or related to a domain name registration record. VeriSign does not\nguarantee its accuracy. By submitting a Whois query, you agree to abide\nby the following terms of use: You agree that you may use this Data only\nfor lawful purposes and that under no circumstances will you use this Data\nto: (1) allow, enable, or otherwise support the transmission of mass\nunsolicited, commercial advertising or solicitations via e-mail, telephone,\nor facsimile; or (2) enable high volume, automated, electronic processes\nthat apply to VeriSign (or its computer systems). The compilation,\nrepackaging, dissemination or other use of this Data is expressly\nprohibited without the prior written consent of VeriSign. You agree not to\nuse electronic processes that are automated and high-volume to access or\nquery the Whois database except as reasonably necessary to register\ndomain names or modify existing registrations. VeriSign reserves the right\nto restrict your access to the Whois database in its sole discretion to ensure\noperational stability.  VeriSign may restrict or terminate your access to the\nWhois database for failure to abide by these terms of use. VeriSign\nreserves the right to modify these terms at any time.\n\nThe Registry database contains ONLY .COM, .NET, .EDU domains and\nRegistrars.\n"
    ],
    "whois_server": ["whois.iana.org"],
    "registrar": ["RESERVED-Internet Assigned Numbers Authority"],
    "id": ["2336799_DOMAIN_COM-VRSN"]
  },
  "yellowpages_result": [],
  "yelp_results": []
}
